<?xml version="1.0" encoding="UTF-8" standalone="yes"?>
<bdjo xmlns:xsi='http://www.w3.org/2001/XMLSchema-instance'
   xsi:noNamespaceSchemaLocation='bdjo.xsd'>
    <appCacheInfo>
        <entries>
            <language>*.*</language>
            <name>00001</name>
            <type>1</type>
        </entries>
        <entries>
            <language>*.*</language>
            <name>00002</name>
            <type>1</type>
        </entries>
        <entries>
            <language>*.*</language>
            <name>00003</name>
            <type>1</type>
        </entries>
        <entries>
            <language>*.*</language>
            <name>00004</name>
            <type>1</type>
        </entries>
    </appCacheInfo>
    <applicationManagementTable>
        <applications>
            <applicationDescriptor>
                <profiles>
                    <majorVersion>1</majorVersion>
                    <microVersion>0</microVersion>
                    <minorVersion>0</minorVersion>
                    <profile>1</profile>
                </profiles>
                <profiles>
                    <majorVersion>1</majorVersion>
                    <microVersion>0</microVersion>
                    <minorVersion>0</minorVersion>
                    <profile>2</profile>
                </profiles>
                <priority>128</priority>
                <visibility>V_01</visibility>
                <iconLocator></iconLocator>
                <iconFlags>0</iconFlags>
                <baseDirectory>00001</baseDirectory>
                <classpathExtension></classpathExtension>
                <initialClassName>com.hdcookbook.bookmenu.monitor.MonitorXlet</initialClassName>
            </applicationDescriptor>
            <applicationId>0x4001</applicationId>
            <controlCode>1</controlCode>
            <organizationId>0x56789abc</organizationId>
            <type>1</type>
        </applications>
        <applications>
            <applicationDescriptor>
                <profiles>
                    <majorVersion>1</majorVersion>
                    <microVersion>0</microVersion>
                    <minorVersion>0</minorVersion>
                    <profile>1</profile>
                </profiles>
                <profiles>
                    <majorVersion>1</majorVersion>
                    <microVersion>0</microVersion>
                    <minorVersion>0</minorVersion>
                    <profile>2</profile>
                </profiles>
                <priority>128</priority>
                <binding>TITLE_BOUND_DISC_BOUND</binding>
                <visibility>V_01</visibility>
                <iconLocator></iconLocator>
                <iconFlags>0</iconFlags>
                <baseDirectory>00002</baseDirectory>
                <classpathExtension></classpathExtension>
                <initialClassName>com.hdcookbook.bookmenu.menu.MenuXlet</initialClassName>
            </applicationDescriptor>
            <applicationId>0x4002</applicationId>
            <controlCode>1</controlCode>
            <organizationId>0x56789abc</organizationId>
            <type>1</type>
        </applications>
        <applications>
            <applicationDescriptor>
                <profiles>
                    <majorVersion>1</majorVersion>
                    <microVersion>0</microVersion>
                    <minorVersion>0</minorVersion>
                    <profile>1</profile>
                </profiles>
                <profiles>
                    <majorVersion>1</majorVersion>
                    <microVersion>0</microVersion>
                    <minorVersion>0</minorVersion>
                    <profile>2</profile>
                </profiles>
                <priority>128</priority>
                <binding>TITLE_BOUND_DISC_BOUND</binding>
                <visibility>V_01</visibility>
                <iconLocator></iconLocator>
                <iconFlags>0</iconFlags>
                <baseDirectory>00003</baseDirectory>
                <classpathExtension></classpathExtension>
                <initialClassName>com.hdcookbook.gunbunny.GunBunnyXlet</initialClassName>
            </applicationDescriptor>
            <applicationId>0x0003</applicationId>
            <controlCode>2</controlCode>
            <organizationId>0x56789abc</organizationId>
            <type>1</type>
        </applications>
    </applicationManagementTable>
    <fileAccessInfo></fileAccessInfo>
    <keyInterestTable>0</keyInterestTable>
    <tableOfAccessiblePlayLists>
        <accessToAllFlag>true</accessToAllFlag>
        <autostartFirstPlayListFlag>false</autostartFirstPlayListFlag>
    </tableOfAccessiblePlayLists>
    <terminalInfo>
        <defaultFontFile>00000</defaultFontFile>
        <initialHaviConfig>HD_1920_1080</initialHaviConfig>
        <menuCallMask>false</menuCallMask>
        <titleSearchMask>false</titleSearchMask>
	<mouseInterest>true</mouseInterest>
	<mouseSupported>true</mouseSupported>
    </terminalInfo>
    <version>V_0200</version>
</bdjo>
